{
  "$schema": "https://json-schema.org/draft/2020-12/schema",
  "$id": "https://healthyduoduo.local/schemas/report.schema.json",
  "title": "Report",
  "description": "系统对一张图像处理后产出的结构化报告(实施计划 4.2;report_id / image_id 等由 Go 落库时赋予,不在契约内)",
  "type": "object",
  "additionalProperties": false,
  "required": ["report_type", "report_date", "status", "items",
    "exam_name", "exam_name_ocr_line_numbers", "findings", "findings_ocr_line_numbers",
    "impression", "impression_ocr_line_numbers"],
  "properties": {
    "report_type": {
      "type": "string",
      "minLength": 1,
      "description": "报告大类(临检/生化/免疫/激素/影像/其他专项;临检及后续按需为 logical merge——同大类可能由多个词典文件分发)"
    },
    "report_date": {
      "type": ["string", "null"],
      "pattern": "^[0-9]{4}-[0-9]{2}-[0-9]{2}$",
      "description": "检查日期(YYYY-MM-DD);识别失败且未通过 ingest --date 补录时为 null"
    },
    "status": {
      "enum": ["success", "partial", "failed"],
      "description": "success=类别与主要指标解析成功;partial=有产出但有指标缺失/低置信/日期未解析;failed=无法产出结构化结果(仍留痕落库)"
    },
    "items": {
      "type": "array",
      "items": {"$ref": "#/$defs/reportItem"}
    },
    "exam_name": {
      "type": ["string", "null"],
      "minLength": 1,
      "description": "检查项目/部位行原文;非影像报告为 null"
    },
    "exam_name_ocr_line_numbers": {
      "type": ["array", "null"],
      "items": {"type": "integer", "minimum": 0},
      "minItems": 1,
      "description": "检查项目原文对应的 OCR 行下标(0-based,与 txts/boxes 同下标);文本为 null 时为 null"
    },
    "findings": {
      "type": ["string", "null"],
      "minLength": 1,
      "description": "检查所见段落原文(行文本按序拼接);非影像报告为 null"
    },
    "findings_ocr_line_numbers": {
      "type": ["array", "null"],
      "items": {"type": "integer", "minimum": 0},
      "minItems": 1,
      "description": "检查所见段落对应的 OCR 行下标(0-based,与 txts/boxes 同下标);文本为 null 时为 null"
    },
    "impression": {
      "type": ["string", "null"],
      "minLength": 1,
      "description": "超声/检查提示段落原文(行文本按序拼接);非影像报告为 null"
    },
    "impression_ocr_line_numbers": {
      "type": ["array", "null"],
      "items": {"type": "integer", "minimum": 0},
      "minItems": 1,
      "description": "超声/检查提示段落对应的 OCR 行下标(0-based,与 txts/boxes 同下标);文本为 null 时为 null"
    }
  },
  "allOf": [
    {
      "if": {"properties": {"exam_name": {"type": "string"}}, "required": ["exam_name"]},
      "then": {"properties": {"exam_name_ocr_line_numbers": {"type": "array"}}},
      "else": {"properties": {"exam_name_ocr_line_numbers": {"type": "null"}}}
    },
    {
      "if": {"properties": {"findings": {"type": "string"}}, "required": ["findings"]},
      "then": {"properties": {"findings_ocr_line_numbers": {"type": "array"}}},
      "else": {"properties": {"findings_ocr_line_numbers": {"type": "null"}}}
    },
    {
      "if": {"properties": {"impression": {"type": "string"}}, "required": ["impression"]},
      "then": {"properties": {"impression_ocr_line_numbers": {"type": "array"}}},
      "else": {"properties": {"impression_ocr_line_numbers": {"type": "null"}}}
    }
  ],
  "$defs": {
    "reportItem": {
      "type": "object",
      "additionalProperties": false,
      "required": ["name", "value", "unit", "ref_range", "flag", "low_confidence", "raw_text", "ocr_line_numbers"],
      "properties": {
        "name": {
          "type": "string",
          "minLength": 1,
          "description": "规范名(词典映射后)"
        },
        "value": {
          "type": ["string", "null"],
          "description": "印刷原样数值字符串(如 '18.40'、'<2.00'、'70-80');无结果或解析失败为 null"
        },
        "unit": {
          "type": ["string", "null"],
          "description": "单位,如 g/L"
        },
        "ref_range": {
          "type": ["string", "null"],
          "description": "参考范围,一律从检查单抽取(决策 #8),如 115-150 或 <3.5"
        },
        "method": {
          "type": ["string", "null"],
          "description": "检测方法/实验方法列原样(如 '化学发光法');无该列或解析失败为 null"
        },
        "flag": {
          "enum": ["normal", "high", "low", "unknown"],
          "description": "数值与参考范围比较结果;无参考范围或非数值为 unknown"
        },
        "low_confidence": {
          "type": "boolean",
          "description": "该指标项任一组成行 OCR score < 0.8 时为 true(决策 #7)"
        },
        "raw_text": {
          "type": "string",
          "minLength": 1,
          "description": "该指标项对应的原始 OCR 行文本,供人工核对"
        },
        "ocr_line_numbers": {
          "type": "array",
          "items": {"type": "integer", "minimum": 0},
          "description": "该指标项组成 OCR 行的下标(0-based,与 ocr_result 的 txts/boxes 同下标;顺序与 raw_text 组成顺序一致)"
        }
      }
    }
  }
}
