{"report_type":"影像","report_date":null,"status":"partial","items":[{"name":"双顶径","value":"18","unit":"mm","ref_range":null,"method":null,"flag":"unknown","low_confidence":false,"raw_text":"胎儿超声测值：胎儿颈项透明层厚度（NT）2.6mm，头臀长59mm，双顶径18mm。","ocr_line_numbers":[21]},{"name":"头臀长","value":"59","unit":"mm","ref_range":null,"method":null,"flag":"unknown","low_confidence":false,"raw_text":"胎儿超声测值：胎儿颈项透明层厚度（NT）2.6mm，头臀长59mm，双顶径18mm。","ocr_line_numbers":[21]},{"name":"宫颈管长度","value":"36","unit":"mm","ref_range":null,"method":null,"flag":"unknown","low_confidence":false,"raw_text":"子宫颈管长约36mm。","ocr_line_numbers":[19]},{"name":"羊水最大深度","value":"31","unit":"mm","ref_range":null,"method":null,"flag":"unknown","low_confidence":false,"raw_text":"胎盘附着于子宫前壁，厚度：11mm，成熟度0级，羊水最大前后径31mm。","ocr_line_numbers":[22]},{"name":"胎心率","value":"159","unit":"次/分","ref_range":null,"method":null,"flag":"unknown","low_confidence":false,"raw_text":"增大的子宫腔内可见一胎儿回声。见胎心搏动及胎动，胎心率159次/分，律齐。","ocr_line_numbers":[20]},{"name":"颈项透明层厚度","value":"2.6","unit":"mm","ref_range":null,"method":null,"flag":"unknown","low_confidence":false,"raw_text":"胎儿超声测值：胎儿颈项透明层厚度（NT）2.6mm，头臀长59mm，双顶径18mm。","ocr_line_numbers":[21]}],"exam_name":"筛查(自费)、11-14周NT筛查(生育)","exam_name_ocr_line_numbers":[16],"findings":"经腹扫查：\n子宫颈管长约36mm。\n增大的子宫腔内可见一胎儿回声。见胎心搏动及胎动，胎心率159次/分，律齐。\n胎儿超声测值：胎儿颈项透明层厚度（NT）2.6mm，头臀长59mm，双顶径18mm。\n胎盘附着于子宫前壁，厚度：11mm，成熟度0级，羊水最大前后径31mm。\n双上肢前臂及上臂切面可见，双下肢大腿及小腿切面可见。脐部未见明确包块向外膨出。\n母体双侧附件区未见明显异常回声。\n子宫动脉血流频谱：右侧子宫动脉血流：PI 1.58：左侧子宫动脉血流：PI 1.68。","findings_ocr_line_numbers":[18,19,20,21,22,23,24,25],"impression":"宫内单活胎，胎儿超声测值评估约孕12W+3d大小。\n胎儿颈项透明层厚度（NT）2.6mm，建议产前门诊咨询及及进一步检查。\n胎儿颈项透明层厚度在正常范围内。\n母体子宫动脉血流频谱暂未见明显异常。\n注：此次检查主要测量胎儿NT（颈项透明层厚度）、估测胎儿孕周及对胎儿部分结构进行检查，不进\n行系统胎儿结构检查，特此告知。建议孕20-24周行II-III级胎儿产前超声检查。","impression_ocr_line_numbers":[27,28,29,30,31,32]}
