{"report_type":"影像","report_date":null,"status":"partial","items":[{"name":"侧脑室宽度","value":"9.1","unit":null,"ref_range":null,"method":null,"flag":"unknown","low_confidence":false,"raw_text":"9.1mm，右：8.2mm，小脉及小脑蝶部凝示，后颅窝池4.0mm。  胎儿头面：腾线述续，预骨环完整，脑中线居中，两侧丘脑可见，双侧侧脑室室，左：","ocr_line_numbers":[19,18]},{"name":"双顶径","value":"57","unit":null,"ref_range":null,"method":null,"flag":"unknown","low_confidence":false,"raw_text":"BPD 57m，BC 202mm，AC 174m，FL. 37mm，HL36mm，小槽径 24mm","ocr_line_numbers":[13]},{"name":"后颅窝池宽度","value":"4.0","unit":"mm","ref_range":null,"method":null,"flag":"unknown","low_confidence":false,"raw_text":"9.1mm，右：8.2mm，小脉及小脑蝶部凝示，后颅窝池4.0mm。","ocr_line_numbers":[19]},{"name":"羊水最大深度","value":"59","unit":"mm","ref_range":null,"method":null,"flag":"unknown","low_confidence":false,"raw_text":"羊水：羊水最大深度59mm。","ocr_line_numbers":[29]},{"name":"股骨长","value":"37","unit":"mm","ref_range":null,"method":null,"flag":"unknown","low_confidence":false,"raw_text":"BPD 57m，BC 202mm，AC 174m，FL. 37mm，HL36mm，小槽径 24mm","ocr_line_numbers":[13]},{"name":"肱骨长","value":"36","unit":"mm","ref_range":null,"method":null,"flag":"unknown","low_confidence":false,"raw_text":"BPD 57m，BC 202mm，AC 174m，FL. 37mm，HL36mm，小槽径 24mm","ocr_line_numbers":[13]},{"name":"胎心率","value":"143","unit":"次/分","ref_range":null,"method":null,"flag":"unknown","low_confidence":false,"raw_text":"系一致，胎儿心率：143次/分，律齐。","ocr_line_numbers":[21]},{"name":"脐动脉S/D","value":"3.20","unit":null,"ref_range":null,"method":null,"flag":"unknown","low_confidence":false,"raw_text":"脐带：脐动脉两根，颈周围未见脐彩色血流环绕，脐动脉S/D值：3.20、脐动脉P1：","ocr_line_numbers":[26]},{"name":"腹围","value":"174","unit":null,"ref_range":null,"method":null,"flag":"unknown","low_confidence":false,"raw_text":"BPD 57m，BC 202mm，AC 174m，FL. 37mm，HL36mm，小槽径 24mm","ocr_line_numbers":[13]},{"name":"颈项皮肤褶皱厚度","value":"4.7","unit":"mm","ref_range":null,"method":null,"flag":"unknown","low_confidence":false,"raw_text":"NF:4.7mm，鼻骨长：5.8mm，CPC，左-，右-，EB-。18F：左2mm×2m、2m×1mm","ocr_line_numbers":[15]},{"name":"鼻骨长","value":"5.8","unit":"mm","ref_range":null,"method":null,"flag":"unknown","low_confidence":false,"raw_text":"NF:4.7mm，鼻骨长：5.8mm，CPC，左-，右-，EB-。18F：左2mm×2m、2m×1mm","ocr_line_numbers":[15]}],"exam_name":"输儿吨形系统育查迎言现·彩超？档案号：","exam_name_ocr_line_numbers":[4],"findings":"子宫前壁肌层及双侧附件区未见明显异常肿块。\n宫内妊娠，头位ROT。\n胎儿生长指标：\nBPD 57m，BC 202mm，AC 174m，FL. 37mm，HL36mm，小槽径 24mm\n超声软指标：\nNF:4.7mm，鼻骨长：5.8mm，CPC，左-，右-，EB-。18F：左2mm×2m、2m×1mm\n右一。肾孟分离：左一，右一。\n各系统超声观察：\n胎儿头面：腾线述续，预骨环完整，脑中线居中，两侧丘脑可见，双侧侧脑室室，左：\n9.1mm，右：8.2mm，小脉及小脑蝶部凝示，后颅窝池4.0mm。\n胎儿胸腔：双肺显示，心脏位置未见明显异常，四腔切面可显示，左右房室比例基本对\n系一致，胎儿心率：143次/分，律齐。\n胎儿腹部内脏：腹壁完整，肝胆、胃肠、双肾、膀眠可见。\n胎儿脊柱、四肢：脊椎颈、胸、腰、瓢、尾段排列尚整齐、可显示生理弯曲，左、右上\n肢内脂骨、尺骨，@骨可呢，左、右下胶内股骨、胫骨、腓骨可无。\n胎儿附属结构：\n脐带：脐动脉两根，颈周围未见脐彩色血流环绕，脐动脉S/D值：3.20、脐动脉P1：\nL.13.脐带远鸡附着于胎象实质。\n胎盘：胎盘附着于子宫右后壁，厚24m。\n羊水：羊水最大深度59mm。","findings_ocr_line_numbers":[10,11,12,13,14,15,16,17,18,19,20,21,22,23,24,25,26,27,28,29],"impression":"宫内妊娠，胎儿存活，始儿发育相当于22:3孕周。\n胎儿结构暂未见明显异常声像。","impression_ocr_line_numbers":[31,32]}
