{"report_type":"生化","report_date":"2021-08-02","status":"success","items":[{"name":"丙氨酸转氨酶","value":"835","unit":"U/L","ref_range":"7-40","method":null,"flag":"high","low_confidence":false,"raw_text":"丙氨酸转氨酶(ALT)  835 ↑  7-40U/L","ocr_line_numbers":[27,28,29]},{"name":"天冬氨酸转氨酶","value":"488","unit":"U/L","ref_range":"13-35","method":null,"flag":"high","low_confidence":false,"raw_text":"天冬氨酸转氨酶(AST)  488 ↑  13-35U/L","ocr_line_numbers":[30,31,32]},{"name":"总胆红素","value":"17.5","unit":"μmol/L","ref_range":"≤21.0","method":null,"flag":"normal","low_confidence":false,"raw_text":"总胆红素(TBIL)  17.5  ≤21.0μmol/L","ocr_line_numbers":[33,34,35]},{"name":"直接胆红素","value":"7.9","unit":"μmol/L","ref_range":"≤8.0","method":null,"flag":"normal","low_confidence":false,"raw_text":"直接胆红素(DBIL)  7.9  ≤8.0μmol/L","ocr_line_numbers":[36,37,38]},{"name":"总胆汁酸","value":"47","unit":"μmol/L","ref_range":"≤10","method":null,"flag":"high","low_confidence":false,"raw_text":"总胆汁酸(TBA)  47↑  ≤10μmol/L","ocr_line_numbers":[39,40,41]},{"name":"碱性磷酸酶","value":"150","unit":"U/L","ref_range":"50-135","method":null,"flag":"high","low_confidence":false,"raw_text":"碱性磷酸酶(ALP)  150 ↑  50-135U/L","ocr_line_numbers":[42,43,44]},{"name":"谷氨酰转肽酶","value":"89","unit":"U/L","ref_range":"7-45","method":null,"flag":"high","low_confidence":false,"raw_text":"r-谷氨酰转移酶(GGT)  89 ↑  7-45U/L","ocr_line_numbers":[45,46,47]},{"name":"总蛋白","value":"76","unit":"g/L","ref_range":"65-85","method":null,"flag":"normal","low_confidence":false,"raw_text":"总蛋白(TP)  76  65-85g/L","ocr_line_numbers":[48,49,50]},{"name":"白蛋白","value":"42","unit":"g/L","ref_range":"40-55","method":null,"flag":"normal","low_confidence":false,"raw_text":"白蛋白(ALB)  42  40-55g/L","ocr_line_numbers":[51,52,53]},{"name":"球蛋白","value":"34","unit":"g/L","ref_range":"20-40","method":null,"flag":"normal","low_confidence":false,"raw_text":"球蛋白(GLO)  34  20-40g/L","ocr_line_numbers":[54,55,56]},{"name":"白蛋白/球蛋白","value":"1.24","unit":null,"ref_range":"1.20-2.40","method":null,"flag":"normal","low_confidence":false,"raw_text":"白球比例(A/G)  1.24  1.20-2.40","ocr_line_numbers":[57,58,59]},{"name":"前白蛋白","value":"82","unit":"mg/L","ref_range":"185--350","method":null,"flag":"low","low_confidence":false,"raw_text":"前白蛋白(PA)  82↓  185--350mg/L","ocr_line_numbers":[60,61,62]},{"name":"尿素","value":"4.1","unit":"mmol/L","ref_range":"2.6--7.5","method":null,"flag":"normal","low_confidence":false,"raw_text":"尿素(BUN)  4.1  2.6--7.5mmol/L","ocr_line_numbers":[63,64,65]},{"name":"肌酐","value":"51","unit":"μmol/L","ref_range":"41--73","method":null,"flag":"normal","low_confidence":false,"raw_text":"肌酐(CRE)  51  41--73μmol/L","ocr_line_numbers":[66,67,68]},{"name":"尿酸","value":"0.246","unit":"mmol/L","ref_range":"0.100-0.420","method":null,"flag":"normal","low_confidence":false,"raw_text":"尿酸(UA)  0.246  0.100-0.420mmol/L","ocr_line_numbers":[69,70,71]},{"name":"eGFR","value":"107.3","unit":"ml/min","ref_range":"≥90","method":null,"flag":"normal","low_confidence":false,"raw_text":"eGFR(EPI公式计算)(eGFR)  107.3  ≥90ml/min","ocr_line_numbers":[72,73,74]},{"name":"血清胱抑素C","value":"0.75","unit":"mg/L","ref_range":"0.59-1.03","method":null,"flag":"normal","low_confidence":false,"raw_text":"血清胱抑素C(CysC)  0.75  0.59-1.03mg/L","ocr_line_numbers":[75,76,77]}],"exam_name":null,"exam_name_ocr_line_numbers":null,"findings":null,"findings_ocr_line_numbers":null,"impression":null,"impression_ocr_line_numbers":null}
