{"report_type":"生化","report_date":"2020-01-01","status":"success","items":[{"name":"铜蓝蛋白","value":"0.266","unit":"g/L","ref_range":"0.21-0.53","method":null,"flag":"normal","low_confidence":false,"raw_text":"1 铜蓝蛋白(CER)  0.266  0.21-0.53  g/L","ocr_line_numbers":[21,22,23,24]}],"exam_name":null,"exam_name_ocr_line_numbers":null,"findings":null,"findings_ocr_line_numbers":null,"impression":null,"impression_ocr_line_numbers":null}
