{"report_type":"免疫","report_date":"2020-01-01","status":"partial","items":[{"name":"抗RNP抗体","value":"0.43","unit":"AU","ref_range":"0-20","method":"流式荧光发光法","flag":"normal","low_confidence":false,"raw_text":"抗RNP抗体(RNP)  0.43  0-20  AU  流式荧光发光法","ocr_line_numbers":[20,23,24,27,28]},{"name":"抗Sm抗体","value":"0.64","unit":"AU","ref_range":"0-20","method":"流式荧光发光法","flag":"normal","low_confidence":false,"raw_text":"抗Sm抗体(Sm)  0.64  0-20  AU  流式荧光发光法","ocr_line_numbers":[26,29,30,33,34]},{"name":"抗SS-A 60抗体","value":"1.06","unit":"AU","ref_range":"0-20","method":"流式荧光发光法","flag":"normal","low_confidence":false,"raw_text":"抗SS-A 60抗体(SS-A 60)  1.06  0-20  AU  流式荧光发光法","ocr_line_numbers":[32,35,36,39,40]},{"name":"抗SS-A 52抗体","value":"0.88","unit":"AU","ref_range":"0-20","method":"流式荧光发光法","flag":"normal","low_confidence":false,"raw_text":"抗SS-A 52抗体(SS-A 52)  0.88  0-20  AU  流式荧光发光法","ocr_line_numbers":[38,41,42,45,46]},{"name":"抗SS-B抗体","value":"0.33","unit":"AU","ref_range":"0-20","method":"流式荧光发光法","flag":"normal","low_confidence":false,"raw_text":"抗SS-B抗体(SS-B)  0.33  0-20  AU  流式荧光发光法","ocr_line_numbers":[44,47,48,51,52]},{"name":"抗Scl-70抗体","value":"0.81","unit":"AU","ref_range":"0-20","method":"流式荧光发光法","flag":"normal","low_confidence":false,"raw_text":"抗Sc1-70抗体(Sc1-70)  0.81  0-20  AU  流式荧光发光法","ocr_line_numbers":[50,53,54,58,59]},{"name":"抗PM-Scl抗体","value":"0.39","unit":"AU","ref_range":"0-20","method":"流式荧光发光法","flag":"normal","low_confidence":false,"raw_text":"抗PM-Scl抗体(PM-Scl)  0.39  0-20  AU  流式荧光发光法","ocr_line_numbers":[56,57,60,63,64]},{"name":"抗Jo-1抗体","value":null,"unit":"AU","ref_range":"0-20","method":"流式荧光发光法","flag":"unknown","low_confidence":false,"raw_text":"抗Jo-1抗体(Jo-1)  0-20  AU  流式荧光发光法","ocr_line_numbers":[62,65,68,69]},{"name":"抗CENP B抗体","value":null,"unit":"AU","ref_range":"0-20","method":"流式荧光发光法","flag":"unknown","low_confidence":false,"raw_text":"抗CENP B抗体(CENP B)  0-20  AU  流式荧光发光法","ocr_line_numbers":[67,70,73,74]},{"name":"抗PCNA抗体","value":null,"unit":"AU","ref_range":"0-20","method":"流式荧光发光法","flag":"unknown","low_confidence":false,"raw_text":"抗PCNA抗体(PCNA)  0-20  AU  流式荧光发光法","ocr_line_numbers":[72,75,78,79]},{"name":"抗Nucleosome抗体","value":null,"unit":"AU","ref_range":"0-20","method":"流式荧光发光法","flag":"unknown","low_confidence":false,"raw_text":"抗Nucleosome抗体(Nucleosome)  0-20  AU  流式荧光发光法","ocr_line_numbers":[77,82,83,84]},{"name":"抗Histone抗体","value":null,"unit":"AU","ref_range":"0-20","method":"流式荧光发光法","flag":"unknown","low_confidence":false,"raw_text":"抗Histone抗体(Histone)  0-20  AU  流式荧光发光法","ocr_line_numbers":[81,87,88,89]},{"name":"抗Ribosomal P抗体","value":null,"unit":"AU","ref_range":"0-20","method":"流式荧光发光法","flag":"unknown","low_confidence":false,"raw_text":"抗Ribosomal P抗体(Ribosomal P)  0-20  AU  流式荧光发光法","ocr_line_numbers":[86,90,94,95]},{"name":"抗AMA-M2抗体","value":"1","unit":"AU","ref_range":"0-20","method":"流式荧光发光法","flag":"normal","low_confidence":false,"raw_text":"抗AMA-M2抗体(AMA-M2)  1  0-20  AU  流式荧光发光法","ocr_line_numbers":[92,93,96,99,100]},{"name":"抗C1q抗体","value":null,"unit":"0.","ref_range":"0-10","method":"流式荧光发光法","flag":"unknown","low_confidence":false,"raw_text":"抗C1q抗体(C1q)  0.  0-10  流式荧光发光法","ocr_line_numbers":[98,101,102,105]},{"name":"抗dsDNA抗体","value":"<2.00","unit":"IU/mL","ref_range":"0-30","method":"化学发光法","flag":"unknown","low_confidence":false,"raw_text":"16 抗dsDNA抗体(dsDNA)  <2.00  0-30  IU/mL  化学发光法","ocr_line_numbers":[103,106,107,108,109]}],"exam_name":null,"exam_name_ocr_line_numbers":null,"findings":null,"findings_ocr_line_numbers":null,"impression":null,"impression_ocr_line_numbers":null}
